{
  "$schema": "https://json-schema.org/draft/2020-12/schema",
  "$id": "https://perfeng.dev/schemas/browser-environment/v1/browser-environment.schema.json",
  "$defs": {
    "id": {
      "type": "string",
      "description": "a string matching the pattern ^[a-z][a-z0-9]*(?:-[a-z0-9]+)*$",
      "pattern": "^[a-z][a-z0-9]*(?:-[a-z0-9]+)*$"
    },
    "version": {
      "type": "string",
      "description": "a string matching the pattern ^(0|[1-9][0-9]*)\\.(0|[1-9][0-9]*)\\.(0|[1-9][0-9]*)$",
      "pattern": "^(0|[1-9][0-9]*)\\.(0|[1-9][0-9]*)\\.(0|[1-9][0-9]*)$"
    },
    "sha256": {
      "type": "string",
      "description": "a string matching the pattern ^[a-f0-9]{64}$",
      "pattern": "^[a-f0-9]{64}$"
    },
    "timestamp": {
      "type": "string",
      "format": "date-time",
      "description": "a string matching the pattern ^\\d{4}-\\d{2}-\\d{2}T\\d{2}:\\d{2}:[0-5]\\d(?:\\.\\d{1,6})?(?:Z|[+-]\\d{2}:\\d{2})$",
      "pattern": "^\\d{4}-\\d{2}-\\d{2}T\\d{2}:\\d{2}:[0-5]\\d(?:\\.\\d{1,6})?(?:Z|[+-]\\d{2}:\\d{2})$"
    }
  },
  "type": "object",
  "required": [
    "schemaVersion",
    "kind",
    "runId",
    "profile",
    "fingerprint",
    "host",
    "browser",
    "calibration",
    "capturedAt"
  ],
  "properties": {
    "schemaVersion": {
      "type": "number",
      "enum": [
        1
      ]
    },
    "kind": {
      "type": "string",
      "enum": [
        "BrowserEnvironment"
      ]
    },
    "runId": {
      "type": "string",
      "description": "Reference to the run metadata",
      "pattern": "^perf-[0-9]{8}-[0-9]{6}-[a-f0-9]{8}$"
    },
    "profile": {
      "type": "object",
      "required": [
        "id",
        "version"
      ],
      "properties": {
        "id": {
          "$ref": "#/$defs/id"
        },
        "version": {
          "$ref": "#/$defs/version"
        }
      },
      "additionalProperties": false
    },
    "fingerprint": {
      "$ref": "#/$defs/sha256"
    },
    "host": {
      "type": "object",
      "required": [
        "virtualization",
        "os",
        "cpu",
        "memory",
        "gpu",
        "display",
        "power"
      ],
      "properties": {
        "virtualization": {
          "type": "string",
          "enum": [
            "physical",
            "virtual"
          ]
        },
        "os": {
          "type": "object",
          "required": [
            "family",
            "edition",
            "version",
            "build",
            "architecture"
          ],
          "properties": {
            "family": {
              "type": "string",
              "enum": [
                "windows",
                "linux",
                "macos"
              ]
            },
            "edition": {
              "type": "string",
              "description": "a string at least 1 character(s) long",
              "title": "minLength(1)",
              "minLength": 1
            },
            "version": {
              "type": "string",
              "description": "a string at least 1 character(s) long",
              "title": "minLength(1)",
              "minLength": 1
            },
            "build": {
              "type": "string",
              "description": "a string at least 1 character(s) long",
              "title": "minLength(1)",
              "minLength": 1
            },
            "architecture": {
              "type": "string",
              "enum": [
                "x64",
                "arm64"
              ]
            }
          },
          "additionalProperties": false
        },
        "cpu": {
          "type": "object",
          "required": [
            "model",
            "logicalCores",
            "availableLogicalCores"
          ],
          "properties": {
            "model": {
              "type": "string",
              "description": "a string at least 1 character(s) long",
              "title": "minLength(1)",
              "minLength": 1
            },
            "logicalCores": {
              "type": "integer",
              "description": "a number greater than or equal to 1",
              "title": "greaterThanOrEqualTo(1)",
              "minimum": 1
            },
            "physicalCores": {
              "type": "integer",
              "description": "a number greater than or equal to 1",
              "title": "greaterThanOrEqualTo(1)",
              "minimum": 1
            },
            "availableLogicalCores": {
              "type": "number",
              "description": "a positive number",
              "title": "greaterThan(0)",
              "exclusiveMinimum": 0
            }
          },
          "additionalProperties": false
        },
        "memory": {
          "type": "object",
          "required": [
            "totalBytes",
            "availableBytes"
          ],
          "properties": {
            "totalBytes": {
              "type": "integer",
              "description": "a number greater than or equal to 1",
              "title": "greaterThanOrEqualTo(1)",
              "minimum": 1
            },
            "availableBytes": {
              "type": "integer",
              "description": "a non-negative number",
              "title": "greaterThanOrEqualTo(0)",
              "minimum": 0
            }
          },
          "additionalProperties": false
        },
        "gpu": {
          "type": "object",
          "required": [
            "model",
            "driverVersion",
            "hardwareAcceleration"
          ],
          "properties": {
            "model": {
              "type": "string",
              "description": "a string at least 1 character(s) long",
              "title": "minLength(1)",
              "minLength": 1
            },
            "driverVersion": {
              "type": "string",
              "description": "a string at least 1 character(s) long",
              "title": "minLength(1)",
              "minLength": 1
            },
            "hardwareAcceleration": {
              "type": "boolean"
            }
          },
          "additionalProperties": false
        },
        "display": {
          "type": "object",
          "required": [
            "width",
            "height",
            "scaleFactor",
            "refreshRateHz"
          ],
          "properties": {
            "width": {
              "type": "integer",
              "description": "a number greater than or equal to 1",
              "title": "greaterThanOrEqualTo(1)",
              "minimum": 1
            },
            "height": {
              "type": "integer",
              "description": "a number greater than or equal to 1",
              "title": "greaterThanOrEqualTo(1)",
              "minimum": 1
            },
            "scaleFactor": {
              "type": "number",
              "description": "a positive number",
              "title": "greaterThan(0)",
              "exclusiveMinimum": 0
            },
            "refreshRateHz": {
              "type": "number",
              "description": "a positive number",
              "title": "greaterThan(0)",
              "exclusiveMinimum": 0
            }
          },
          "additionalProperties": false
        },
        "power": {
          "type": "object",
          "required": [
            "source",
            "plan",
            "batterySaver"
          ],
          "properties": {
            "source": {
              "type": "string",
              "enum": [
                "ac",
                "battery",
                "unknown"
              ]
            },
            "plan": {
              "type": "string",
              "description": "a string at least 1 character(s) long",
              "title": "minLength(1)",
              "minLength": 1
            },
            "batterySaver": {
              "type": "boolean"
            }
          },
          "additionalProperties": false
        }
      },
      "additionalProperties": false
    },
    "browser": {
      "type": "object",
      "required": [
        "name",
        "channel",
        "version",
        "headless"
      ],
      "properties": {
        "name": {
          "type": "string",
          "enum": [
            "chromium",
            "firefox",
            "webkit"
          ]
        },
        "channel": {
          "type": "string",
          "description": "a string at least 1 character(s) long",
          "title": "minLength(1)",
          "minLength": 1
        },
        "version": {
          "type": "string",
          "description": "a string at least 1 character(s) long",
          "title": "minLength(1)",
          "minLength": 1
        },
        "headless": {
          "type": "boolean"
        }
      },
      "additionalProperties": false
    },
    "calibration": {
      "type": "object",
      "required": [
        "status",
        "reasons",
        "idleCpuPercent",
        "availableMemoryBytes",
        "clockSynchronized",
        "softwareRendering"
      ],
      "properties": {
        "status": {
          "type": "string",
          "enum": [
            "ACCEPTED",
            "REJECTED"
          ]
        },
        "reasons": {
          "type": "array",
          "items": {
            "type": "string",
            "description": "a string at least 1 character(s) long",
            "title": "minLength(1)",
            "minLength": 1
          },
          "uniqueItems": true
        },
        "idleCpuPercent": {
          "type": "number",
          "description": "a number between 0 and 100",
          "title": "between(0, 100)",
          "minimum": 0,
          "maximum": 100
        },
        "availableMemoryBytes": {
          "type": "integer",
          "description": "a non-negative number",
          "title": "greaterThanOrEqualTo(0)",
          "minimum": 0
        },
        "clockSynchronized": {
          "type": "boolean"
        },
        "softwareRendering": {
          "type": "boolean"
        }
      },
      "additionalProperties": false,
      "allOf": [
        {
          "if": {
            "properties": {
              "status": {
                "const": "ACCEPTED"
              }
            }
          },
          "then": {
            "properties": {
              "reasons": {
                "maxItems": 0
              }
            }
          },
          "else": {
            "properties": {
              "reasons": {
                "minItems": 1
              }
            }
          }
        }
      ]
    },
    "capturedAt": {
      "$ref": "#/$defs/timestamp"
    }
  },
  "additionalProperties": false,
  "title": "Browser execution environment"
}
